{
  "schema_version": "creator_angle_mapping.v1",
  "version": "0.1.0",
  "updated_at": "2026-06-19",
  "source_contract": "creator_language_to_scoring_dimension_to_signal_to_knowledge_to_tutorial",
  "source_documents": [
    "distillation/douyin-shooting-coach/outputs/methodology/scoring_system_2024_now.md",
    "distillation/douyin-shooting-coach/outputs/scoring_registry.json",
    "distillation/douyin-shooting-coach/outputs/knowledge_base.json"
  ],
  "policy": {
    "purpose": "Translate the creator's coaching language into stable scoring dimensions without copying a private or unverified total-score formula.",
    "no_final_total_score": true,
    "no_practice_game_score_in_v1": true,
    "missing_evidence_policy": "Missing evidence does not become a technical deduction.",
    "root_cause_policy": "Result indicators such as flat arc, slow release, or unstable ball path must route back to upstream dimensions before recommending drills.",
    "manual_first_policy": "Guide-hand and vision mappings remain manual/review-first until hand tracking, ball-hand contact, or dominant-eye inputs are available."
  },
  "mappings": [
    {
      "creator_angle_id": "angle.hand_waits_for_feet",
      "creator_language": "手等脚、脚带手、手慢一点",
      "aliases": ["脚下先快", "上肢不要抢", "感受到脚下力量后再起球", "蹬地后顺势起球"],
      "mapping_type": "direct",
      "mapping_status": "active",
      "primary_dimension_id": "timing_sync",
      "maps_to_dimension_ids": ["timing_sync"],
      "maps_to_problem": "上肢抢节奏、起球过早、手快脚慢",
      "why_this_mapping_is_valid": "这个角度讨论的是起球和下肢启动之间的先后关系。上肢先把球架起时，下肢无法顺势把球送上去，后续容易变成手臂补力，所以应映射到时序同步。",
      "inference_path": [
        "creator observes whether the hand moves before the feet",
        "early hand lift separates ball rise from lower-body push",
        "separated timing creates upper-body compensation",
        "system evaluates timing_sync through ball-lift and lower-body timing evidence"
      ],
      "required_signal_ids": ["coordination.ball_lift_lower_body_timing"],
      "supporting_signal_ids": ["lower_body.preparatory_flexion_pattern"],
      "supporting_metric_ids": ["ball_lift_knee_delta_ms", "knee_angle_series", "ball_height_series", "pose_confidence"],
      "required_views": ["side"],
      "knowledge_concept_ids": ["concept.hand_waits_for_feet", "concept.lower_body_drives_ball_lift"],
      "repair_target_ids": ["repair.sync_ball_lift_with_push", "repair.reduce_upper_body_rush"],
      "tutorial_ids": [
        "tutorial.no_ball_vertical_jump_sequence",
        "tutorial.close_range_sync_ball_lift",
        "tutorial.rhythm_shooting_count"
      ],
      "confidence_policy": "Current automatic candidate when side-view timing signal is available; degrade to review on low fps or missing ball/lower-body reference.",
      "false_positive_checks": [
        "接球投篮、急停和后撤步会改变起球节奏，不能套用定点节奏强判。",
        "低帧率或球被遮挡时，起球时间可能误差过大。"
      ]
    },
    {
      "creator_angle_id": "angle.upper_body_rush_early_lift",
      "creator_language": "上肢先动、起球早、球先架起来",
      "aliases": ["手先架", "起球太早", "球到肩头附近停住", "手快脚慢"],
      "mapping_type": "direct_with_power_chain_effect",
      "mapping_status": "active",
      "primary_dimension_id": "timing_sync",
      "maps_to_dimension_ids": ["timing_sync", "power_chain_integrity"],
      "maps_to_problem": "起球早导致上下肢脱节，并进一步影响发力链完整性",
      "why_this_mapping_is_valid": "起球早本身是时序问题，但它会让下肢发力和球的上升脱开，导致发力链后段只能靠上肢补偿。因此主映射到 timing_sync，次级影响 power_chain_integrity。",
      "inference_path": [
        "creator labels the motion as upper body moving first",
        "early ball lift removes the ball from the lower-body push window",
        "force transfer becomes segmented instead of continuous",
        "system should mark timing first and use it as evidence for power-chain review"
      ],
      "required_signal_ids": ["coordination.ball_lift_lower_body_timing"],
      "supporting_signal_ids": ["release.low_release_height", "posture.forward_trunk_lean_at_release"],
      "supporting_metric_ids": ["ball_lift_knee_delta_ms", "release_height_ratio", "trunk_lean_release_deg"],
      "required_views": ["side"],
      "knowledge_concept_ids": ["concept.upper_body_compensation", "concept.whole_body_power_chain"],
      "repair_target_ids": ["repair.reduce_upper_body_rush", "repair.rebuild_lower_to_upper_sequence"],
      "tutorial_ids": [
        "tutorial.rhythm_shooting_count",
        "tutorial.lower_body_to_ball_lift_sequence"
      ],
      "confidence_policy": "Treat as timing candidate first. Promote power-chain concern only when another downstream signal such as low release or trunk lean supports the same chain break.",
      "false_positive_checks": [
        "个别高水平球员可能有稳定的早起球风格，必须结合出手质量和重复性。",
        "只看到出手后半段时不能判断起球是否真的早。"
      ]
    },
    {
      "creator_angle_id": "angle.power_chain_continuity",
      "creator_language": "动力链打通、力量连续传递",
      "aliases": ["脚踝-膝-髋-躯干-肩肘腕连续", "整条链顺", "不是分段卡顿", "不是靠手硬扔"],
      "mapping_type": "composite",
      "mapping_status": "active",
      "primary_dimension_id": "power_chain_integrity",
      "maps_to_dimension_ids": [
        "power_chain_integrity",
        "timing_sync",
        "lower_body_efficiency",
        "trunk_center_stability",
        "upper_body_release_line",
        "release_quality"
      ],
      "maps_to_problem": "发力链断裂、上肢代偿、力量卡在膝/腰/肩/手",
      "why_this_mapping_is_valid": "发力链完整性是博主评分系统的最高优先级，但它不是单一视觉点。它需要由时序、下肢、躯干、上肢和释放质量共同支持，属于上层组合维度。",
      "inference_path": [
        "creator scores whether lower body, trunk, and upper body form one continuous chain",
        "no single metric can prove the whole chain",
        "multiple lower-level dimensions expose chain breaks from different parts",
        "system aggregates supporting signals into power_chain_integrity as the top-level concern"
      ],
      "required_signal_ids": [
        "coordination.ball_lift_lower_body_timing",
        "lower_body.preparatory_flexion_pattern",
        "posture.forward_trunk_lean_at_release",
        "release.low_release_height"
      ],
      "supporting_signal_ids": [
        "upper_body.elbow_height_and_flexion_preparatory",
        "coordination.elbow_wrist_release_variability",
        "release.release_angle_context"
      ],
      "supporting_metric_ids": [
        "ball_lift_knee_delta_ms",
        "knee_angle_min_deg",
        "trunk_lean_release_deg",
        "release_height_ratio",
        "elbow_angle_release_deg"
      ],
      "required_views": ["side", "front"],
      "knowledge_concept_ids": ["concept.whole_body_power_chain", "concept.lower_body_not_empty_squat"],
      "repair_target_ids": ["repair.rebuild_lower_to_upper_sequence", "repair.convert_leg_drive_to_release"],
      "tutorial_ids": [
        "tutorial.lower_body_to_ball_lift_sequence",
        "tutorial.ankle_snap_release_rhythm"
      ],
      "confidence_policy": "Composite dimension. Current v1 should return candidate/review based on multiple supporting dimensions, not a high-confidence complete power-chain diagnosis.",
      "false_positive_checks": [
        "单个指标异常不能证明整条发力链断裂。",
        "伤病、疲劳、距离变化和个人风格会改变链条表现。"
      ]
    },
    {
      "creator_angle_id": "angle.knee_load_slow_feet",
      "creator_language": "力量压到膝盖、脚下不快、慢出现在膝盖",
      "aliases": ["膝盖耗时", "脚踝速度不足", "蹲了但没弹起来", "触地慢"],
      "mapping_type": "direct_with_context",
      "mapping_status": "active",
      "primary_dimension_id": "lower_body_efficiency",
      "maps_to_dimension_ids": ["lower_body_efficiency", "power_chain_integrity"],
      "maps_to_problem": "下肢效率不足、空蹲、脚踝/髋膝没有把力量快速向上转化",
      "why_this_mapping_is_valid": "这个角度不是单纯批评屈膝，而是在判断下肢屈曲是否转化成向上速度。力量停在膝盖会拖慢起跳和起球，所以映射到下肢效率，并作为发力链问题的上游证据。",
      "inference_path": [
        "creator identifies slow or knee-heavy lower-body loading",
        "knee-heavy loading suggests force is not quickly converted through ankle/hip extension",
        "inefficient lower-body output weakens the whole chain",
        "system evaluates lower_body_efficiency with flexion pattern and shot-distance context"
      ],
      "required_signal_ids": ["lower_body.preparatory_flexion_pattern"],
      "supporting_signal_ids": ["context.shot_distance_changes_mechanics", "coordination.ball_lift_lower_body_timing"],
      "supporting_metric_ids": ["knee_angle_min_deg", "knee_angle_series", "shot_distance", "ball_lift_knee_delta_ms"],
      "required_views": ["side"],
      "knowledge_concept_ids": ["concept.deep_squat_is_not_equal_to_power", "concept.fast_ankle_drive"],
      "repair_target_ids": ["repair.make_lower_body_quicker", "repair.match_lower_body_to_distance"],
      "tutorial_ids": [
        "tutorial.quick_ankle_push",
        "tutorial.distance_progression_lower_body"
      ],
      "confidence_policy": "Do not flag deep knee flexion alone. Require timing, distance, or release-quality context before making it a lower-body efficiency problem.",
      "false_positive_checks": [
        "三分球可能需要更深下肢蓄力。",
        "当前系统脚踝速度仍是 planned signal，不能伪装成已完全识别。"
      ]
    },
    {
      "creator_angle_id": "angle.trunk_forward_drift_low_release",
      "creator_language": "身体前趴、前冲、重心没有回正",
      "aliases": ["躯干前倾", "塌腰", "身体往前找防守人", "出手点被压低"],
      "mapping_type": "direct",
      "mapping_status": "active",
      "primary_dimension_id": "trunk_center_stability",
      "maps_to_dimension_ids": ["trunk_center_stability", "release_quality"],
      "maps_to_problem": "重心与躯干不稳定，释放空间被压缩，出手点偏低",
      "why_this_mapping_is_valid": "前趴会让身体向前而不是向上送球，容易压低释放高度并改变出手角度，因此主映射到重心与躯干稳定，结果层影响出手质量。",
      "inference_path": [
        "creator observes forward body drift or trunk lean",
        "forward drift reduces vertical release space",
        "lower release can flatten or rush the shot",
        "system links trunk_center_stability to release_quality when low release is also present"
      ],
      "required_signal_ids": ["posture.forward_trunk_lean_at_release"],
      "supporting_signal_ids": ["release.low_release_height"],